ID,Source,Domain,Question,Option_A,Option_B,Option_C,Option_D,Correct_Index,Correct_Answer_Text,Explanation,Your_Result
1,udemy-attempt3,cost-optimized-arch,"A leading social media analytics company is contemplating moving its dockerized application stack into AWS Cloud. The company is not sure about the pricing for using Amazon Elastic Container Service (Amazon ECS) with the EC2 launch type compared to the Amazon Elastic Container Service (Amazon ECS) with the Fargate launch type.
Which of the following is correct regarding the pricing for these two s",Correct answer,Amazon ECS with EC2 launch type is charged based on EC2 instances and EBS volumes used. Amazon ECS with Fargate launch type is charged based on vCPU and memory resources that the containerized applica,Both Amazon ECS with EC2 launch type and Amazon ECS with Fargate launch type are just charged based on Elastic Container Service used per hour,Both Amazon ECS with EC2 launch type and Amazon ECS with Fargate launch type are charged based on Amazon EC2 instances and Amazon EBS Elastic Volumes used,0,,"Amazon ECS with EC2 launch type is charged based on EC2 instances and EBS volumes used. Amazon ECS with Fargate launch type is charged based on vCPU and memory resources that the containerized application requests
Amazon Elastic Container Service (Amazon ECS) is a fully managed container orchestration service. ECS allows you to easily run, scale, and secure Docker container applications on AWS.
Am",Incorrect
2,udemy-attempt3,resilient-arch,"The development team at a social media company wants to handle some complicated queries such as ""What are the number of likes on the videos that have been posted by friends of a user A?"".
As a solutions architect, which of the following AWS database services would you suggest as the BEST fit to handle such use cases?",Amazon Redshift,Amazon Neptune,Amazon Aurora,Amazon OpenSearch Service,0,,"Amazon Neptune
Amazon Neptune is a fast, reliable, fully managed graph database service that makes it easy to build and run applications that work with highly connected datasets. The core of Amazon Neptune is a purpose-built, high-performance graph database engine optimized for storing billions of relationships and querying the graph with milliseconds latency. Neptune powers graph use cases such a",Correct
3,udemy-attempt3,cost-optimized-arch,"A financial services company is looking to move its on-premises IT infrastructure to AWS Cloud. The company has multiple long-term server bound licenses across the application stack and the CTO wants to continue to utilize those licenses while moving to AWS.
As a solutions architect, which of the following would you recommend as the MOST cost-effective solution?",Use Amazon EC2 dedicated hosts,Use Amazon EC2 on-demand instances,Use Amazon EC2 reserved instances (RI),Use Amazon EC2 dedicated instances,0,,"Use Amazon EC2 dedicated hosts
You can use Dedicated Hosts to launch Amazon EC2 instances on physical servers that are dedicated for your use. Dedicated Hosts give you additional visibility and control over how instances are placed on a physical server, and you can reliably use the same physical server over time. As a result, Dedicated Hosts enable you to use your existing server-bound software li",Correct
4,udemy-attempt3,high-perf-arch,"A Big Data analytics company wants to set up an AWS cloud architecture that throttles requests in case of sudden traffic spikes. The company is looking for AWS services that can be used for buffering or throttling to handle such traffic variations.
Which of the following services can be used to support this requirement?","Amazon Gateway Endpoints, Amazon Simple Queue Service (Amazon SQS) and Amazon Kinesis","Elastic Load Balancer, Amazon Simple Queue Service (Amazon SQS), AWS Lambda",Correct answer,"Amazon API Gateway, Amazon Simple Queue Service (Amazon SQS) and Amazon Kinesis",3,,"Throttling is the process of limiting the number of requests an authorized program can submit to a given operation in a given amount of time.
Amazon API Gateway, Amazon Simple Queue Service (Amazon SQS) and Amazon Kinesis
To prevent your API from being overwhelmed by too many requests, Amazon API Gateway throttles requests to your API using the token bucket algorithm, where a token counts for a re",Incorrect
5,udemy-attempt3,high-perf-arch,"A big data analytics company is using Amazon Kinesis Data Streams (KDS) to process IoT data from the field devices of an agricultural sciences company. Multiple consumer applications are using the incoming data streams and the engineers have noticed a performance lag for the data delivery speed between producers and consumers of the data streams.
As a solutions architect, which of the following wo",Swap out Amazon Kinesis Data Streams with Amazon Kinesis Data Firehose,Swap out Amazon Kinesis Data Streams with Amazon SQS Standard queues,Swap out Amazon Kinesis Data Streams with Amazon SQS FIFO queues,Correct answer,4,,"Use Enhanced Fanout feature of Amazon Kinesis Data Streams
Amazon Kinesis Data Streams (KDS) is a massively scalable and durable real-time data streaming service. KDS can continuously capture gigabytes of data per second from hundreds of thousands of sources such as website clickstreams, database event streams, financial transactions, social media feeds, IT logs, and location-tracking events.
By d",Incorrect
6,udemy-attempt3,high-perf-arch,"A Big Data analytics company writes data and log files in Amazon S3 buckets. The company now wants to stream the existing data files as well as any ongoing file updates from Amazon S3 to Amazon Kinesis Data Streams.
As a Solutions Architect, which of the following would you suggest as the fastest possible way of building a solution for this requirement?",Leverage Amazon S3 event notification to trigger an AWS Lambda function for the file create event. The AWS Lambda function will then send the necessary data to Amazon Kinesis Data Streams,Amazon S3 bucket actions can be directly configured to write data into Amazon Simple Notification Service (Amazon SNS). Amazon SNS can then be used to send the updates to Amazon Kinesis Data Streams,Correct answer,Leverage AWS Database Migration Service (AWS DMS) as a bridge between Amazon S3 and Amazon Kinesis Data Streams,3,,"Leverage AWS Database Migration Service (AWS DMS) as a bridge between Amazon S3 and Amazon Kinesis Data Streams
You can achieve this by using AWS Database Migration Service (AWS DMS). AWS DMS enables you to seamlessly migrate data from supported sources to relational databases, data warehouses, streaming platforms, and other data stores in AWS cloud.
The given requirement needs the functionality t",Incorrect
7,udemy-attempt3,secure-arch,A media company has its corporate headquarters in Los Angeles with an on-premises data center using an AWS Direct Connect connection to the AWS VPC. The branch offices in San Francisco and Miami use AWS Site-to-Site VPN connections to connect to the AWS VPC. The company is looking for a solution to have the branch offices send and receive data with each other as well as with their corporate headqu,VPC Endpoint,VPC Peering connection,Correct answer,AWS VPN CloudHub,3,,"AWS VPN CloudHub
If you have multiple AWS Site-to-Site VPN connections, you can provide secure communication between sites using the AWS VPN CloudHub. This enables your remote sites to communicate with each other, and not just with the VPC. Sites that use AWS Direct Connect connections to the virtual private gateway can also be part of the AWS VPN CloudHub. The VPN CloudHub operates on a simple hu",Incorrect
8,udemy-attempt3,cost-optimized-arch,"A startup's cloud infrastructure consists of a few Amazon EC2 instances, Amazon RDS instances and Amazon S3 storage. A year into their business operations, the startup is incurring costs that seem too high for their business requirements.
Which of the following options represents a valid cost-optimization solution?",Use Amazon S3 Storage class analysis to get recommendations for transitions of objects to Amazon S3 Glacier storage classes to reduce storage costs. You can also automate moving these objects into low,Use AWS Trusted Advisor checks on Amazon EC2 Reserved Instances to automatically renew reserved instances (RI). AWS Trusted advisor also suggests Amazon RDS idle database instances,Use AWS Compute Optimizer recommendations to help you choose the optimal Amazon EC2 purchasing options and help reserve your instance capacities at reduced costs,Correct answer,4,,"Use AWS Cost Explorer Resource Optimization to get a report of Amazon EC2 instances that are either idle or have low utilization and use AWS Compute Optimizer to look at instance type recommendations
AWS Cost Explorer helps you identify under-utilized Amazon EC2 instances that may be downsized on an instance by instance basis within the same instance family, and also understand the potential impac",Incorrect
9,udemy-attempt3,high-perf-arch,"You have been hired as a Solutions Architect to advise a company on the various authentication/authorization mechanisms that AWS offers to authorize an API call within the Amazon API Gateway. The company would prefer a solution that offers built-in user management.
Which of the following solutions would you suggest as the best fit for the given use-case?",Use AWS_IAM authorization,Use AWS Lambda authorizer for Amazon API Gateway,Use Amazon Cognito User Pools,Use Amazon Cognito Identity Pools,1,,"Use Amazon Cognito User Pools
A user pool is a user directory in Amazon Cognito. You can leverage Amazon Cognito User Pools to either provide built-in user management or integrate with external identity providers, such as Facebook, Twitter, Google+, and Amazon. Whether your users sign-in directly or through a third party, all members of the user pool have a directory profile that you can access th",Correct
10,udemy-attempt3,secure-arch,"An IT company has built a custom data warehousing solution for a retail organization by using Amazon Redshift. As part of the cost optimizations, the company wants to move any historical data (any data older than a year) into Amazon S3, as the daily analytical reports consume data for just the last one year. However the analysts want to retain the ability to cross-reference this historical data al","Use AWS Glue ETL job to load the Amazon S3 based historical data into Redshift. Once the ad-hoc queries are run for the historic data, it can be removed from Amazon Redshift","Use the Amazon Redshift COPY command to load the Amazon S3 based historical data into Amazon Redshift. Once the ad-hoc queries are run for the historic data, it can be removed from Amazon Redshift",Setup access to the historical data via Amazon Athena. The analytics team can run historical data queries on Amazon Athena and continue the daily reporting on Amazon Redshift. In case the reports need,Correct answer,0,,"Use Amazon Redshift Spectrum to create Amazon Redshift cluster tables pointing to the underlying historical data in Amazon S3. The analytics team can then query this historical data to cross-reference with the daily reports from Redshift
Amazon Redshift is a fully-managed petabyte-scale cloud-based data warehouse product designed for large scale data set storage and analysis.
Using Amazon Redshift",Incorrect
11,udemy-attempt3,secure-arch,A retail company uses AWS Cloud to manage its technology infrastructure. The company has deployed its consumer-focused web application on Amazon EC2-based web servers and uses Amazon RDS PostgreSQL database as the data store. The PostgreSQL database is set up in a private subnet that allows inbound traffic from selected Amazon EC2 instances. The database also uses AWS Key Management Service (AWS K,Correct answer,Configure Amazon RDS to use SSL for data in transit,Create a new network access control list (network ACL) that blocks SSH from the entire Amazon EC2 subnet into the database,Use IAM authentication to access the database instead of the database user's access credentials,1,,"Configure Amazon RDS to use SSL for data in transit
You can use Secure Socket Layer / Transport Layer Security (SSL/TLS) connections to encrypt data in transit. Amazon RDS creates an SSL certificate and installs the certificate on the DB instance when the instance is provisioned. For MySQL, you launch the MySQL client using the --ssl_ca parameter to reference the public key to encrypt connections.",Incorrect
12,udemy-attempt3,secure-arch,"An e-commerce application uses an Amazon Aurora Multi-AZ deployment for its database. While analyzing the performance metrics, the engineering team has found that the database reads are causing high input/output (I/O) and adding latency to the write requests against the database.
As an AWS Certified Solutions Architect Associate, what would you recommend to separate the read requests from the writ",Provision another Amazon Aurora database and link it to the primary database as a read replica,Configure the application to read from the Multi-AZ standby instance,Activate read-through caching on the Amazon Aurora database,Set up a read replica and modify the application to use the appropriate endpoint,2,,"Set up a read replica and modify the application to use the appropriate endpoint
An Amazon Aurora DB cluster consists of one or more DB instances and a cluster volume that manages the data for those DB instances. An Aurora cluster volume is a virtual database storage volume that spans multiple Availability Zones (AZs), with each Availability Zone (AZ) having a copy of the DB cluster data. Two type",Correct
13,udemy-attempt3,secure-arch,"A financial services company has deployed its flagship application on Amazon EC2 instances. Since the application handles sensitive customer data, the security team at the company wants to ensure that any third-party Secure Sockets Layer certificate (SSL certificate) SSL/Transport Layer Security (TLS) certificates configured on Amazon EC2 instances via the AWS Certificate Manager (ACM) are renewed",Monitor the `days to expiry` Amazon CloudWatch metric for certificates created via ACM. Create a CloudWatch alarm to monitor such certificates based on the `days to expiry` metric and then trigger a c,Leverage AWS Config managed rule to check if any SSL/TLS certificates created via ACM are marked for expiration within 30 days. Configure the rule to trigger an Amazon SNS notification to the security,Correct answer,Leverage AWS Config managed rule to check if any third-party SSL/TLS certificates imported into ACM are marked for expiration within 30 days. Configure the rule to trigger an Amazon SNS notification t,0,,"Leverage AWS Config managed rule to check if any third-party SSL/TLS certificates imported into ACM are marked for expiration within 30 days. Configure the rule to trigger an Amazon SNS notification to the security team if any certificate expires within 30 days
AWS Certificate Manager is a service that lets you easily provision, manage, and deploy public and private Secure Sockets Layer/Transport ",Incorrect
14,udemy-attempt3,resilient-arch,"A leading online gaming company is migrating its flagship application to AWS Cloud for delivering its online games to users across the world. The company would like to use a Network Load Balancer to handle millions of requests per second. The engineering team has provisioned multiple instances in a public subnet and specified these instance IDs as the targets for the NLB.
As a solutions architect,",Traffic is routed to instances using the primary elastic IP address specified in the primary network interface for the instance,Traffic is routed to instances using the primary public IP address specified in the primary network interface for the instance,Correct answer,Traffic is routed to instances using the primary private IP address specified in the primary network interface for the instance,0,,"Traffic is routed to instances using the primary private IP address specified in the primary network interface for the instance
A Network Load Balancer functions at the fourth layer of the Open Systems Interconnection (OSI) model. It can handle millions of requests per second. After the load balancer receives a connection request, it selects a target from the target group for the default rule. It ",Incorrect
15,udemy-attempt3,high-perf-arch,"A company has grown from a small startup to an enterprise employing over 1000 people. As the team size has grown, the company has recently observed some strange behavior, with Amazon S3 buckets settings being changed regularly.
How can you figure out what's happening without restricting the rights of the users?",Implement an IAM policy to forbid users to change Amazon S3 bucket settings,Correct answer,Use AWS CloudTrail to analyze API calls,Implement a bucket policy requiring AWS Multi-Factor Authentication (AWS MFA) for all operations,2,,"Use AWS CloudTrail to analyze API calls
AWS CloudTrail is a service that enables governance, compliance, operational auditing, and risk auditing of your AWS account. With AWS CloudTrail, you can log, continuously monitor, and retain account activity related to actions across your AWS infrastructure. AWS CloudTrail provides event history of your AWS account activity, including actions taken through",Incorrect
16,udemy-attempt3,cost-optimized-arch,"An Electronic Design Automation (EDA) application produces massive volumes of data that can be divided into two categories. The 'hot data' needs to be both processed and stored quickly in a parallel and distributed fashion. The 'cold data' needs to be kept for reference with quick access for reads and updates at a low cost.
Which of the following AWS services is BEST suited to accelerate the afore",AWS Glue,Amazon FSx for Lustre,Amazon FSx for Windows File Server,Amazon EMR,0,,"Amazon FSx for Lustre
Amazon FSx for Lustre makes it easy and cost-effective to launch and run the world’s most popular high-performance file system. It is used for workloads such as machine learning, high-performance computing (HPC), video processing, and financial modeling. The open-source Lustre file system is designed for applications that require fast storage – where you want your storage to ",Correct
17,udemy-attempt3,secure-arch,"An IT company has an Access Control Management (ACM) application that uses Amazon RDS for MySQL but is running into performance issues despite using Read Replicas. The company has hired you as a solutions architect to address these performance-related challenges without moving away from the underlying relational database schema. The company has branch offices across the world, and it needs the sol","Spin up Amazon EC2 instances in each AWS region, install MySQL databases and migrate the existing data into these new databases","Use Amazon DynamoDB Global Tables to provide fast, local, read and write performance in each region",Correct answer,Use Amazon Aurora Global Database to enable fast local reads with low latency in each region,3,,"Use Amazon Aurora Global Database to enable fast local reads with low latency in each region
Amazon Aurora is a MySQL and PostgreSQL-compatible relational database built for the cloud, that combines the performance and availability of traditional enterprise databases with the simplicity and cost-effectiveness of open source databases. Amazon Aurora features a distributed, fault-tolerant, self-heal",Incorrect
18,udemy-attempt3,cost-optimized-arch,"A media agency stores its re-creatable assets on Amazon Simple Storage Service (Amazon S3) buckets. The assets are accessed by a large number of users for the first few days and the frequency of access falls down drastically after a week. Although the assets would be accessed occasionally after the first week, but they must continue to be immediately accessible when required. The cost of maintaini",Configure a lifecycle policy to transition the objects to Amazon S3 One Zone-Infrequent Access (S3 One Zone-IA) after 7 days,Configure a lifecycle policy to transition the objects to Amazon S3 Standard-Infrequent Access (S3 Standard-IA) after 30 days,Correct answer,Configure a lifecycle policy to transition the objects to Amazon S3 One Zone-Infrequent Access (S3 One Zone-IA) after 30 days,0,,"Configure a lifecycle policy to transition the objects to Amazon S3 One Zone-Infrequent Access (S3 One Zone-IA) after 30 days
Amazon S3 One Zone-IA is for data that is accessed less frequently, but requires rapid access when needed. Unlike other S3 Storage Classes which store data in a minimum of three Availability Zones (AZs), Amazon S3 One Zone-IA stores data in a single Availability Zone (AZ) a",Incorrect
19,udemy-attempt3,high-perf-arch,"A development team has deployed a microservice to the Amazon Elastic Container Service (Amazon ECS). The application layer is in a Docker container that provides both static and dynamic content through an Application Load Balancer. With increasing load, the Amazon ECS cluster is experiencing higher network usage. The development team has looked into the network usage and found that 90% of it is du",Distribute the dynamic content through Amazon S3,Distribute the dynamic content through Amazon EFS,Distribute the static content through Amazon S3,Distribute the static content through Amazon EFS,0,,"Distribute the static content through Amazon S3
You can use Amazon S3 to host a static website. On a static website, individual web pages include static content. They might also contain client-side scripts. To host a static website on Amazon S3, you configure an Amazon S3 bucket for website hosting and then upload your website content to the bucket. When you configure a bucket as a static website,",Correct
20,udemy-attempt3,resilient-arch,"A media company has created an AWS Direct Connect connection for migrating its flagship application to the AWS Cloud. The on-premises application writes hundreds of video files into a mounted NFS file system daily. Post-migration, the company will host the application on an Amazon EC2 instance with a mounted Amazon Elastic File System (Amazon EFS) file system. Before the migration cutover, the com",Correct answer,Configure an AWS DataSync agent on the on-premises server that has access to the NFS file system. Transfer data over the AWS Direct Connect connection to an AWS PrivateLink interface VPC endpoint for ,Configure an AWS DataSync agent on the on-premises server that has access to the NFS file system. Transfer data over the AWS Direct Connect connection to an Amazon S3 bucket by using a VPC gateway end,Configure an AWS DataSync agent on the on-premises server that has access to the NFS file system. Transfer data over the AWS Direct Connect connection to an Amazon S3 bucket by using public VIF. Set u,0,,"Configure an AWS DataSync agent on the on-premises server that has access to the NFS file system. Transfer data over the AWS Direct Connect connection to an AWS PrivateLink interface VPC endpoint for Amazon EFS by using a private VIF. Set up an AWS DataSync scheduled task to send the video files to the Amazon EFS file system every 24 hours
AWS DataSync is an online data transfer service that simpl",Incorrect
21,udemy-attempt3,high-perf-arch,"A Big Data processing company has created a distributed data processing framework that performs best if the network performance between the processing machines is high. The application has to be deployed on AWS, and the company is only looking at performance as the key measure.
As a Solutions Architect, which deployment do you recommend?",Use a Cluster placement group,Optimize the Amazon EC2 kernel using EC2 User Data,Use a Spread placement group,Use Spot Instances,0,,"When you launch a new Amazon EC2 instance, the EC2 service attempts to place the instance in such a way that all of your instances are spread out across underlying hardware to minimize correlated failures. You can use placement groups to influence the placement of a group of interdependent instances to meet the needs of your workload. Depending on the type of workload, you can create a placement g",Correct
22,udemy-attempt3,secure-arch,"The infrastructure team at a company maintains 5 different VPCs (let's call these VPCs A, B, C, D, E) for resource isolation. Due to the changed organizational structure, the team wants to interconnect all VPCs together. To facilitate this, the team has set up VPC peering connection between VPC A and all other VPCs in a hub and spoke model with VPC A at the center. However, the team has still fail",Establish VPC peering connections between all VPCs,Use AWS transit gateway to interconnect the VPCs,Use a VPC endpoint to interconnect the VPCs,Use an internet gateway to interconnect the VPCs,0,,"Use AWS transit gateway to interconnect the VPCs
An AWS transit gateway is a network transit hub that you can use to interconnect your virtual private clouds (VPC) and on-premises networks.
AWS Transit Gateway Overview:
via - __https://docs.aws.amazon.com/vpc/latest/tgw/what-is-transit-gateway.html__

A VPC peering connection is a networking connection between two VPCs that enables you to route tr",Correct
