ID,Source,Domain,Question,Option_A,Option_B,Option_C,Option_D,Correct_Index,Correct_Answer_Text,Explanation,Your_Result
139,dojo-exam1,high-perf-arch,"A retail company receives raw `.csv` data files into its Amazon S3 bucket from multiple sources on an hourly basis, with an average file size of 2 GB.
An automated process must be implemented to convert these `.csv` files into the more efficient Apache Parquet format and store the converted files in another S3 bucket. Additionally, the conversion process must be automatically initiated each time a",Use an AWS Lambda function triggered by an S3 Object Created event to convert the `.csv` files to Parquet format. Use the AWS Transfer Family with SFTP service to move the output files to the target S,Set up an Apache Spark job running in an Amazon EC2 instance and create an Amazon EventBridge rule to monitor S3 Object Created events in the S3 bucket. Configure AWS Lambda to invoke the Spark job fo,"Utilize an AWS Glue extract, transform, and load (ETL) job to process and convert the `.csv` files to Apache Parquet format and then store the output files into the target S3 bucket. Configure an Amaz","Create an ETL (Extract, Transform, Load) job and a Data Catalog table in AWS Glue. Configure the Glue crawler to run on a schedule to check for new files in the S3 bucket every hour and convert them t",0,"is: Utilize an AWS Glue extract, transform, and load (ETL) job to process and convert the `.csv` files to Apache Parquet format and then store the output files into the target S3 bucket. Configure an ","AWS Glue is a powerful ETL service that easily moves data between different data stores. By using AWS Glue, you can create and manage ETL jobs to transfer data from various sources, such as Amazon S3, Amazon RDS, and Amazon Redshift. Additionally, AWS Glue enables you to transform data as needed to fit specific requirements. One of the key advantages of AWS Glue is its automatic schema discovery a",Incorrect
140,dojo-exam1,resilient-arch,"A pharmaceutical company has resources hosted on both its on-premises network and in the AWS cloud. The company requires all Software Architects to access resources in both environments using on-premises credentials, which are stored in Active Directory.
In this scenario, which of the following can be used to fulfill this requirement?",Set up SAML 2.0-Based Federation by using a Microsoft Active Directory Federation Service.,Use Amazon VPC,Use IAM users,Set up SAML 2.0-Based Federation by using a Web Identity Federation.,0,is: Set up SAML 2.0-Based Federation by using a Microsoft Active Directory Federation Service.,"Since the company is using Microsoft Active Directory which implements Security Assertion Markup Language (SAML), you can set up a SAML-Based Federation for API Access to your AWS cloud. In this way, you can easily connect to AWS using the login credentials of your on-premises network.

AWS supports identity federation with SAML 2.0, an open standard that many identity providers (IdPs) use. This f",Incorrect
141,dojo-exam1,high-perf-arch,"A travel photo-sharing website is using Amazon S3 to serve high-quality photos to visitors. After a few days, it was discovered that other travel websites are linking to and using these photos. This has resulted in financial losses for the business.
What is the MOST effective method to mitigate this issue?",Use Amazon CloudFront distributions for your photos.,Store and privately serve the high-quality photos on Amazon WorkDocs instead.,Block the IP addresses of the offending websites using NACL.,Configure your S3 bucket to remove public read access and use pre-signed URLs with expiry dates.,3,is: Configure your S3 bucket to remove public read access and use pre-signed URLs with expiry dates.,"In Amazon S3, all objects are private by default. Only the object owner has permission to access these objects. However, the object owner can optionally share objects with others by creating a pre-signed URL, using their own security credentials, to grant time-limited permission to download the objects.
When you create a pre-signed URL for your object, you must provide your security credentials, s",Incorrect
142,dojo-exam1,secure-arch,"A company plans to migrate its on-premises workload to AWS. The current architecture is composed of a Microsoft SharePoint server that uses a Windows shared file storage. The Solutions Architect needs to use a cloud storage solution that is highly available and can be integrated with Active Directory for access control and authentication.
Which of the following options can satisfy the given requir",Create a file system using Amazon FSx for Windows File Server and join it to an Active Directory domain in AWS.,Create a file system using Amazon EFS and join it to an Active Directory domain.,Create a Network File System (NFS) file share using AWS Storage Gateway.,Launch an Amazon EC2 Windows Server to mount a new Amazon S3 bucket as a file volume.,0,is: Create a file system using Amazon FSx for Windows File Server and join it to an Active Directory domain in AWS.,"Amazon FSx for Windows File Server provides fully managed, highly reliable, and scalable file storage that is accessible over the industry-standard Service Message Block (SMB) protocol. It is built on Windows Server, delivering a wide range of administrative features such as user quotas, end-user file restore, and Microsoft Active Directory (AD) integration. Amazon FSx is accessible from Windows, ",Correct
143,dojo-exam1,resilient-arch,"A financial services company plans to migrate its trading application from on-premises Microsoft Windows Server to Amazon Web Services (AWS). The solution must ensure high availability across multiple Availability Zones and offer low-latency access to block storage.
Which of the following solutions will fulfill these requirements?",Deploy the trading application on Amazon EC2 Windows Server instances across two Availability Zones. Use Amazon FSx for Windows File Server for shared storage.,Configure the trading application on Amazon EC2 Windows instances across two Availability Zones. Use Amazon Simple Storage Service (Amazon S3) for storage and configure cross-region replication to syn,Deploy the trading application on Amazon EC2 Windows Server instances across two Availability Zones. Use Amazon Elastic File System (Amazon EFS) to provide shared storage between the instances. Config,Configure the trading application on Amazon EC2 Windows Server instances across two Availability Zones. Use Amazon FSx for NetApp ONTAP to create a Multi-AZ file system and access the data via iSCSI p,0,is: Configure the trading application on Amazon EC2 Windows Server instances across two Availability Zones. Use Amazon FSx for NetApp ONTAP to create a Multi-AZ file system and access the data via iSC,"Amazon FSx for NetApp ONTAP is a fully managed AWS service that provides high-performance, scalable file storage based on NetApp’s ONTAP file system. It offers versatile storage options, supporting both file (NFS, SMB) and block (iSCSI) protocols, making it compatible with Windows, Linux, and macOS environments.

The Amazon FSx for NetApp ONTAP features Multi-AZ file systems designed to ensure con",Incorrect
144,dojo-exam1,resilient-arch,"A company hosted an e-commerce website on an Auto Scaling group of Amazon EC2 instances behind an Application Load Balancer. The Solutions Architect noticed that the website is receiving a high number of illegitimate external requests from multiple systems with frequently changing IP addresses. To address the performance issues, the Solutions Architect must implement a solution that would block th",Create a rate-based rule in AWS WAF and associate the web ACL to an Application Load Balancer.,Create a custom network ACL and associate it with the subnet of the Application Load Balancer to block the offending requests.,Create a regular rule in AWS WAF and associate the web ACL to an Application Load Balancer.,Create a custom rule in the security group of the Application Load Balancer to block the offending requests.,0,is: Create a rate-based rule in AWS WAF and associate the web ACL to an Application Load Balancer.,"AWS WAF is tightly integrated with Amazon CloudFront, the Application Load Balancer (ALB), Amazon API Gateway, and AWS AppSync – services that AWS customers commonly use to deliver content for their websites and applications. When you use AWS WAF on Amazon CloudFront, your rules run in all AWS Edge Locations, located around the world close to your end-users. This means security doesn’t come at the",Incorrect
145,dojo-exam1,cost-optimized-arch,"An application consists of multiple Amazon EC2 instances in private subnets in different availability zones. The application uses a single NAT Gateway for downloading software patches from the Internet to the instances. There is a requirement to protect the application from a single point of failure when the NAT Gateway encounters a failure or if its availability zone goes down.
How should the Sol",Create a NAT Gateway in each availability zone. Configure the route table in each private subnet to ensure that instances use the NAT Gateway in the same availability zone,Create two NAT Gateways in each availability zone. Configure the route table in each public subnet to ensure that instances use the NAT Gateway in the same availability zone.,Create three NAT Gateways in each availability zone. Configure the route table in each private subnet to ensure that instances use the NAT Gateway in the same availability zone.,Create a NAT Gateway in each availability zone. Configure the route table in each public subnet to ensure that instances use the NAT Gateway in the same availability zone.,0,is: Create a NAT Gateway in each availability zone. Configure the route table in each private subnet to ensure that instances use the NAT Gateway in the same availability zone.,"A NAT Gateway is a highly available, managed Network Address Translation (NAT) service for your resources in a private subnet to access the Internet. NAT gateway is created in a specific Availability Zone and implemented with redundancy in that zone.
You must create a NAT gateway on a public subnet to enable instances in a private subnet to connect to the Internet or other AWS services, but preven",Incorrect
146,dojo-exam1,secure-arch,"A telecommunications company is planning to grant AWS Console access to its developers. Company policy requires the use of identity federation and role-based access control. Currently, the roles are already assigned via groups in the corporate Active Directory.
In this scenario, what combination of the following services can provide developers access to the AWS console? (Select TWO.)",AWS Directory Service Simple AD,IAM Groups,AWS Directory Service AD Connector,IAM Roles,0,"AWS Directory Service AD Connector.
–  IAM Roles.
AWS Directory Service Simple AD is incorrect because this only provides a subset of the features offered by AWS Managed Microsoft AD, including the ab","AWS Directory Service provides multiple ways to use Amazon Cloud Directory and Microsoft Active Directory (AD) with other AWS services. Directories store information about users, groups, and devices, and administrators use them to manage access to information and resources. AWS Directory Service provides multiple directory choices for customers who want to use existing Microsoft AD or Lightweight ",Incorrect
147,dojo-exam1,high-perf-arch,"A company is using a combination of API Gateway and AWS Lambda for the web services of an online web portal that is accessed by hundreds of thousands of clients each day. The company will be announcing a new revolutionary product, and it is expected that the web portal will receive a massive number of visitors from all around the globe.
How can the back-end systems and applications be protected fr",Deploy Multi-AZ in API Gateway with Read Replica,API Gateway will automatically scale and handle massive traffic spikes so you do not have to do anything.,Use throttling limits in API Gateway,Manually upgrade the Amazon EC2 instances being used by API Gateway,0,is: Use throttling limits in API Gateway.,"Amazon API Gateway provides throttling at multiple levels including global and by a service call. Throttling limits can be set for standard rates and bursts. For example, API owners can set a rate limit of 1,000 requests per second for a specific method in their REST APIs, and also configure Amazon API Gateway to handle a burst of 2,000 requests per second for a few seconds.

Amazon API Gateway tr",Incorrect
148,dojo-exam1,secure-arch,"A company has recently migrated its microservices-based application to Amazon Elastic Kubernetes Service (Amazon EKS). As part of the migration, the company must ensure that all sensitive configuration data and credentials, such as database passwords and API keys, are stored securely and encrypted within the Amazon EKS cluster’s etcd key-value store.
What is the most suitable solution to meet the ",Use Amazon EKS default options and the Amazon Elastic Block Store (Amazon EBS) Container Storage Interface (CSI) driver as an add-on to securely store sensitive data within the Amazon EKS cluster.,Enable secret encryption with a new AWS KMS key on an existing Amazon EKS cluster to encrypt sensitive data stored in the EKS cluster's etcd key-value store.,Use AWS Secrets Manager with a new AWS KMS key to securely manage and store sensitive data within the EKS cluster's etcd key-value store.,Enable default Amazon EBS volume encryption for the account with a new AWS KMS key to ensure encryption of sensitive data within the Amazon EKS cluster.,0,is: Enable secret encryption with a new AWS KMS key on an existing Amazon EKS cluster to encrypt sensitive data stored in the EKS cluster’s etcd key-value store.,"Enabling secret encryption with a new AWS Key Management Service (KMS) key in an existing Amazon Elastic Kubernetes Service (EKS) cluster is critical to securing sensitive data stored in the cluster’s etcd key-value store. Amazon EKS is a service for running and managing containerized applications, storing configuration data and secrets, etc., and is a distributed data store. By default, these sec",Incorrect
149,dojo-exam1,resilient-arch,"A company plans to launch an Amazon EC2 instance in a private subnet for its internal corporate web portal. For security purposes, the EC2 instance must send data to Amazon DynamoDB and Amazon S3 via private endpoints that don’t pass through the public Internet.
Which of the following can meet the above requirements?",Use a DynamoDB VPC endpoint and an S3 VPC endpoint to route all access to these services via private endpoints.,Enable DynamoDB Encryption at Rest with the default AWS-managed key and S3 Server-Side Encryption with the default AWS KMS key to route all traffic to DynamoDB and S3 via private endpoints.,Use AWS Direct Connect to route all access to S3 and DynamoDB via private endpoints.,Use AWS VPN CloudHub to route all access to S3 and DynamoDB via private endpoints.,0,is: Use a DynamoDB VPC endpoint and an S3 VPC endpoint to route all access to these services via private endpoints.,"A VPC endpoint allows you to privately connect your VPC to supported AWS and VPC endpoint services powered by AWS PrivateLink without needing an Internet gateway, NAT computer, VPN connection, or AWS Direct Connect connection. Instances in your VPC do not require public IP addresses to communicate with resources in the service. Traffic between your VPC and the other service does not leave the Amaz",Correct
150,dojo-exam1,cost-optimized-arch,"An application that records weather data every minute is deployed in a fleet of Amazon EC2 Spot instances and uses a MySQL RDS database instance. Currently, there is only one Amazon RDS instance running in one Availability Zone. The database needs to be improved to ensure high availability by enabling synchronous data replication to another RDS instance.
Which of the following performs synchronous",Amazon DynamoDB Read Replica,Amazon CloudFront running as a Multi-AZ deployment,RDS Read Replica,RDS DB instance running as a Multi-AZ deployment,0,,"When you create or modify your DB instance to run as a Multi-AZ deployment, Amazon RDS automatically provisions and maintains a synchronous standby replica in a different Availability Zone. Updates to your DB Instance are synchronously replicated across Availability Zones to the standby in order to keep both in sync and protect your latest database updates against DB instance failure.

Therefore, ",Incorrect
151,dojo-exam1,cost-optimized-arch,"A company wishes to query data that resides in multiple AWS accounts from a central data lake. Each account has its own Amazon S3 bucket that stores data unique to its business function. Access to the data lake must be granted based on user roles.
Which solution will minimize overhead and costs while meeting the required access patterns?",Use AWS Control Tower to centrally manage each account's S3 buckets.,Create a scheduled AWS Lambda function using Amazon EventBridge for transferring data from multiple accounts to the S3 buckets of the central account.,Use AWS Lake Formation to consolidate data from multiple accounts into a single account.,Use Amazon Data Firehose to consolidate data from multiple accounts into a single account.,0,,"AWS Lake Formation is a service that makes it easy to set up a secure data lake in days. A data lake is a centralized, curated, and secured repository that stores all your data, both in its original form and prepared for analysis. A data lake enables you to break down data silos and combine different types of analytics to gain insights and guide better business decisions.
Amazon S3 forms the stora",Incorrect
152,dojo-exam1,resilient-arch,"A company has a highly available architecture consisting of an Elastic Load Balancer and multiple Amazon EC2 instances configured with Auto Scaling across three Availability Zones. The company needs to monitor EC2 instances based on a specific metric that is not readily available in Amazon CloudWatch.
Which of the following is a custom metric in CloudWatch that requires manual setup?",`Memory Utilization` of an EC2 instance,`CPU Utilization` of an EC2 instance,`Disk Read activity` of an EC2 instance,`Network packets out` of an EC2 instance,0,is: `Memory Utilization` of an EC2 instance.,Amazon CloudWatch has Amazon EC2 Metrics available for monitoring. CPU Utilization identifies the processing power required to run an application upon a selected instance. `Network Utilization` identifies the volume of incoming and outgoing network traffic to a single instance. The `Disk Read` metric is used to determine the volume of data the application reads from the hard disk of the instance. ,Incorrect
153,dojo-exam1,resilient-arch,"A company needs to deploy at least two Amazon EC2 instances to support the normal workloads of its application and automatically scale up to six EC2 instances to handle the peak load. The architecture must be highly available and fault-tolerant as it is processing mission-critical workloads.
As a Solutions Architect, what should be done to meet this requirement?",Create an Auto Scaling group of EC2 instances and set the minimum capacity to 2 and the maximum capacity to 6. Deploy 4 instances in Availability Zone A.,Create an Auto Scaling group of EC2 instances and set the minimum capacity to 4 and the maximum capacity to 6. Deploy 2 instances in Availability Zone A and another 2 instances in Availability Zone B.,Create an Auto Scaling group of EC2 instances and set the minimum capacity to 2 and the maximum capacity to 6. Use 2 Availability Zones and deploy 1 instance for each AZ.,Create an Auto Scaling group of EC2 instances and set the minimum capacity to 2 and the maximum capacity to 4. Deploy 2 instances in Availability Zone A and 2 instances in Availability Zone B.,0,is: Create an Auto Scaling group of EC2 instances and set the minimum capacity to 4 and the maximum capacity to 6. Deploy 2 instances in Availability Zone A and another 2 instances in Availability Zon,"Amazon EC2 Auto Scaling helps ensure that you have the correct number of Amazon EC2 instances available to handle the load for your application. You create collections of EC2 instances, called Auto Scaling groups. You can specify the minimum number of instances in each Auto Scaling group, and Amazon EC2 Auto Scaling ensures that your group never goes below this size. You can also specify the maxim",Incorrect
154,dojo-exam1,resilient-arch,"A financial application consists of an Auto Scaling group of Amazon EC2 instances, an Application Load Balancer, and a MySQL RDS instance set up in a Multi-AZ Deployment configuration. To protect customers’ confidential data, it must be ensured that the Amazon RDS database is only accessible using an authentication token specific to the profile credentials of EC2 instances.
Which of the following ",Use a combination of IAM and STS to enforce restricted access to your RDS instance using a temporary authentication token.,Configure SSL in your application to encrypt the database connection to RDS.,Create an IAM Role and assign it to your EC2 instances which will grant exclusive access to your RDS instance.,Enable the IAM DB Authentication.,3,is: Enable the IAM DB Authentication.,"You can authenticate to your DB instance using AWS Identity and Access Management (IAM) database authentication. IAM database authentication works with MySQL and PostgreSQL. With this authentication method, you don’t need to use a password when you connect to a DB instance. Instead, you use an authentication token.
An authentication token is a unique string of characters that Amazon RDS generates ",Incorrect
155,dojo-exam1,resilient-arch,A Solutions Architect is designing a highly available relational database solution to mitigate the risk of a multi-region failure. The database must meet a Recovery Point Objective (RPO) of 1 second and a Recovery Time Objective (RTO) of less than 1 minute. The architect needs a disaster recovery plan that enables automatic cross-region replication with minimal data loss and rapid recovery in the ,Amazon DynamoDB Global table,Amazon Aurora Global Database,Amazon Timestream for Analytics,Amazon RDS for PostgreSQL with cross-region read replicas,1,is: Amazon Aurora Global Database.,"Amazon Aurora Global Database is designed for globally distributed applications, allowing a single Amazon Aurora database to span multiple AWS regions. It replicates your data with no impact on database performance, enables fast local reads with low latency in each region, and provides disaster recovery from region-wide outages.

Aurora Global Database supports storage-based replication that has a",Correct
156,dojo-exam1,high-perf-arch,"A company is in the process of migrating their applications to AWS. One of their systems requires a database that can scale globally and handle frequent schema changes. The application should not have any downtime or performance issues whenever there is a schema change in the database. It should also provide a low latency response to high-traffic queries.
Which is the most suitable database soluti",Amazon DynamoDB,An Amazon RDS instance in Multi-AZ Deployments configuration,Redshift,An Amazon Aurora database with Read Replicas,0,,"Before we proceed in answering this question, we must first be clear with the actual definition of a “schema“. Basically, the english definition of a schema is: a representation of a plan or theory in the form of an outline or model.
Just think of a schema as the “structure” or a “model” of your data in your database. Since the scenario requires that the schema, or the structure of your data, chan",Incorrect
157,dojo-exam1,high-perf-arch,"A government agency plans to store confidential tax documents on AWS. Due to the sensitive information in the files, the Solutions Architect must restrict the data access requests made to the storage solution to a specific Amazon VPC only. The solution should also prevent the files from being deleted or overwritten to meet the regulatory requirement of having a write-once-read-many (WORM) storage ",Enable Object Lock but disable Object Versioning on the new Amazon S3 bucket to comply with the write-once-read-many (WORM) storage model requirement.,Set up a new Amazon S3 bucket to store the tax documents and integrate it with AWS Network Firewall. Configure the Network Firewall to only accept data access requests from a specific VPC.,Configure an Amazon S3 Access Point for the S3 bucket to restrict data access to a particular VPC only.,Create a new Amazon S3 bucket with the S3 Object Lock feature enabled. Store the documents in the bucket and set the Legal Hold option for object retention.,1,"Configure an Amazon S3 Access Point for the S3 bucket to restrict data access to a particular VPC only.
– Create a new Amazon S3 bucket with the S3 Object Lock feature enabled. Store the documents in ","Amazon S3 access points simplify data access for any AWS service or customer application that stores data in S3. Access points are named network endpoints that are attached to buckets that you can use to perform S3 object operations, such as `GetObject` and `PutObject`.
Each access point has distinct permissions and network controls that S3 applies for any request that is made through that access ",Incorrect
