ID,Source,Domain,Question,Option_A,Option_B,Option_C,Option_D,Correct_Index,Correct_Answer_Text,Explanation,Your_Result
273,dojo-exam3,secure-arch,"A company runs a multi-tier web application in the AWS Cloud. The application tier is hosted on Amazon EC2 instances and the backend database is hosted on an Amazon Aurora for MySQL DB cluster. For security compliance, all of the application variables such as DB hostnames, environment settings, product keys, and database passwords must be stored securely with encryption.
Which of the following opt",Store the values by creating SecureString type parameters in AWS Systems Manager Parameter Store. Use AWS Key Management Service (AWS KMS) for the encryption. Update the application to retrieve the pa,Store the values in a file saved in an Amazon S3 bucket. Enable encryption on the S3 bucket. Configure the application to download the file contents when it starts.,"Store the values as key-value pairs in AWS Systems Manager OpsCenter. By default, the key-value pairs will be encrypted at rest. Configure the application to retrieve the variables when it starts.",Store the values by creating secrets in AWS Secrets Manager. Use AWS Key Management Service (AWS KMS) for the encryption. Use the `BatchGetSecretValue` API to retrieve multiple secrets efficiently. Up,0,,"AWS Systems Manager is a collection of capabilities to help you manage your applications and infrastructure running in the AWS Cloud. Systems Manager simplifies application and resource management, shortens the time to detect and resolve operational problems, and helps you manage your AWS resources securely at scale.
Parameter Store provides secure, hierarchical storage for configuration data and ",Incorrect
274,dojo-exam3,resilient-arch,"A company plans to use a durable storage service to store on-premises database backups to the AWS cloud. To move their backup data, they need to use a service that can store and retrieve objects through standard file storage protocols for quick recovery.
Which of the following options will meet this requirement?",Use AWS Snowball Edge to directly backup the data in Amazon S3 Glacier.,Use the AWS Storage Gateway file gateway to store all the backup data in Amazon S3.,Use Amazon EBS volumes to store all the backup data and attach it to an Amazon EC2 instance.,Use the AWS Storage Gateway volume gateway to store the backup data and directly access it using Amazon S3 API actions.,1,is: Use the AWS Storage Gateway file gateway to store all the backup data in Amazon S3.,"File Gateway presents a file-based interface to Amazon S3, which appears as a network file share. It enables you to store and retrieve Amazon S3 objects through standard file storage protocols. File Gateway allows your existing file-based applications or devices to use secure and durable cloud storage without needing to be modified. With File Gateway, your configured S3 buckets will be available a",Incorrect
275,dojo-exam3,secure-arch,"An online stock trading application stores financial data in an Amazon S3 bucket, with a lifecycle policy that moves older data to Glacier every month. A strict compliance requirement mandates that a surprise audit can occur at any time, and the required data must be retrievable in under 15 minutes under all circumstances. The manager has instructed that retrieval capacity be available when needed",Use Standard Retrieval for accessing the financial data.,Use Expedited Retrieval to access the financial data.,"Specify a range, or portion, of the financial data archive to retrieve.",Purchase provisioned retrieval capacity.,0,"Use Expedited Retrieval to access the financial data.
– Purchase provisioned retrieval capacity.","Expedited retrievals allow you to quickly access your data when occasional urgent requests for a subset of archives are required. For all but the largest archives (250 MB+), data accessed using Expedited retrievals are typically made available within 1–5 minutes. Provisioned Capacity ensures that retrieval capacity for Expedited retrievals is available when you need it.
To make an Expedited, Stand",Incorrect
276,dojo-exam3,high-perf-arch,"A company has a global online trading platform in which users from all over the world regularly upload terabytes of transactional data to a centralized Amazon S3 bucket.
Which of the following should be used in the present system to improve throughput and ensure consistently fast data transfer to the S3 bucket, regardless of the user’s location?",Use Amazon CloudFront Origin Access Control (OAC),AWS Direct Connect,S3 Transfer Acceleration,None of the above,0,"is: S3 Transfer Acceleration.
FTP is incorrect because the File Transfer Protocol does not guarantee fast throughput and consistent, fast data transfer.
AWS Direct Connect is incorrect because you hav","Amazon S3 Transfer Acceleration enables fast, easy, and secure transfers of files over long distances between your client and your Amazon S3 bucket. Transfer Acceleration leverages Amazon CloudFront’s globally distributed AWS Edge Locations. As data arrives at an AWS Edge Location, data is routed to your Amazon S3 bucket over an optimized network path.

Hence, the correct answer is: S3 Transfer Ac",Incorrect
277,dojo-exam3,cost-optimized-arch,"A large financial firm in the country has an AWS environment that contains several Reserved EC2 instances hosting a web application that has been decommissioned last week. To save costs, you need to stop incurring charges for the Reserved instances as soon as possible.
What cost-effective steps will you take in this circumstance? (Select TWO.)",Go to the Amazon.com online shopping website and sell the Reserved instances.,Contact AWS to cancel your AWS subscription.,Terminate the Reserved instances as soon as possible to avoid getting billed at the on-demand price when it expires.,Stop the Reserved instances as soon as possible.,0,"Go to the AWS Reserved Instance Marketplace and sell the Reserved instances.
– Terminate the Reserved instances as soon as possible to avoid getting billed at the on-demand price when it expires.
Stop","The Reserved Instance Marketplace is a platform that supports the sale of third-party and AWS customers’ unused Standard Reserved Instances, which vary in terms of lengths and pricing options. For example, you may want to sell Reserved Instances after moving instances to a new AWS region, changing to a new instance type, ending projects before the term expiration, when your business needs change, ",Incorrect
278,dojo-exam3,resilient-arch,A tech company is currently using Auto Scaling for their web application. A new AMI now needs to be used for launching a fleet of EC2 instances. Which of the following changes needs to be done?,Create a new target group.,Create a new launch template.,Create a new target group and launch template.,Do nothing. You can start directly launching EC2 instances in the Auto Scaling group with the same launch template.,1,is: Create a new launch template.,"A launch template is a template that an Auto Scaling group uses to launch EC2 instances. When you create a launch template, you specify information for the instances, such as the ID of the Amazon Machine Image (AMI), the instance type, a key pair, one or more security groups, and a block device mapping. If you’ve launched an EC2 instance before, you specified the same information in order to launc",Incorrect
279,dojo-exam3,cost-optimized-arch,"A company is building an automation tool for generating custom reports on its AWS usage. The company must be able to programmatically access and forecast usage costs on specific services.
Which of the following would meet the requirements with the LEAST amount of operational overhead?",Configure AWS Budgets to send usage cost data to the company via Amazon SNS.,Generate AWS Budgets reports for usage cost data and deliver them via Amazon Simple Queue Service (SQS).,Utilize the downloadable AWS Cost Explorer report .csv files to access the cost-related data. Predict usage costs using AWS Budgets.,Use the AWS Cost Explorer API with pagination to programmatically retrieve the usage cost-related data.,3,is: Use the AWS Cost Explorer API with pagination to programmatically retrieve the usage cost-related data.,"AWS Cost Explorer is a service provided by Amazon Web Services (AWS) that helps you visualize, understand, and analyze your AWS costs and usage. It provides a comprehensive set of tools and features to help you monitor and manage your AWS spending.

The primary purpose of AWS Cost Explorer is to help you gain insights into your AWS costs and usage patterns over time. It lets you view and analyze y",Incorrect
280,dojo-exam3,high-perf-arch,"A company is using Amazon VPC that has a CIDR block of `10.31.0.0/27` that is connected to the on-premises data center. There was a requirement to create a Lambda function that will process massive amounts of cryptocurrency transactions every minute and then store the results to EFS. After setting up the serverless architecture and connecting the Lambda function to the VPC, the Solutions Architect",Your VPC does not have a NAT gateway.,Your Lambda function exceeds the VPC quota for Elastic Network Interfaces (ENIs) or available IP addresses in the subnet.,The Lambda function is placed in a VPC subnet with limited IP address capacity.,The attached IAM execution role of your function does not have the necessary permissions to access the resources of your VPC.,0,,"Amazon VPC (Virtual Private Cloud) is a service that enables you to create a virtual network. This virtual network is logically isolated from other networks, giving you full control over your virtual networking environment. It allows you to choose your own IP address range, create subnets, and configure route tables and network gateways. With VPC, you can securely connect your AWS resources to you",Incorrect
281,dojo-exam3,high-perf-arch,"A company is storing its financial reports and regulatory documents in an Amazon S3 bucket. To comply with the IT audit, they tasked their Solutions Architect to track all new objects added to the bucket as well as the removed ones. It should also track whether a versioned object is permanently deleted. The Architect must configure Amazon S3 to publish notifications for these events to a queue for",Create a new Amazon SNS topic and Amazon SQS queue. Add an S3 event notification configuration on the bucket to publish `s3:ObjectCreated:*` and `s3:ObjectRemoved:Delete` event types to SQS and SNS.,Create a new Amazon SNS topic and Amazon MQ. Add an S3 event notification configuration on the bucket to publish `s3:ObjectCreated:*` and `ObjectRemoved:DeleteMarkerCreated` event types to SQS and SNS,Create a new Amazon SNS topic and Amazon SQS queue. Add an S3 event notification configuration on the bucket to publish `s3:ObjectCreated:*` and `ObjectRemoved:DeleteMarkerCreated` event types to SQS ,Create a new Amazon SNS topic and Amazon MQ. Add an S3 event notification configuration on the bucket to publish `s3:ObjectAdded:*` and `s3:ObjectRemoved:*` event types to SQS and SNS.,0,is: Create a new Amazon SNS topic and Amazon SQS queue. Add an S3 event notification configuration on the bucket to publish `s3:ObjectCreated:*` and `s3:ObjectRemoved:Delete` event types to SQS and SN,"The Amazon S3 notification feature enables you to receive notifications when certain events happen in your bucket. To enable notifications, you must first add a notification configuration that identifies the events you want Amazon S3 to publish and the destinations where you want Amazon S3 to send the notifications. You store this configuration in the notification subresource that is associated wi",Incorrect
282,dojo-exam3,high-perf-arch,"The media company that you are working for has a video transcoding application running on Amazon EC2. Each EC2 instance polls a queue to find out which video should be transcoded, and then runs a transcoding process. If this process is interrupted, the video will be transcoded by another instance based on the queuing system. This application has a large backlog of videos which need to be transcode",Dedicated instances,On-demand instances,Spot instances,Reserved instances,0,,"You require an instance that will be used not as a primary server but as a spare compute resource to augment the transcoding process of your application. These instances should also be terminated once the backlog has been significantly reduced. In addition, the scenario mentions that if the current process is interrupted, the video can be transcoded by another instance based on the queuing system.",Incorrect
283,dojo-exam3,high-perf-arch,"A call center wants to use Artificial Intelligence(AI) to extract insights from audio recordings to assess the quality of its customer service. The calls are available in both English and Hindi. A sentiment analysis report in English must be generated for each recording to assess whether or not the customer had a positive experience. Once the solution is completed, new languages will eventually be",Convert audio recordings into text using Amazon Transcribe. Set up Amazon Translate to translate Hindi texts into English and use Amazon Comprehend for sentiment analysis.,Set up Amazon Comprehend to convert audio recordings into text. Use Amazon Kendra to translate Hindi texts into English and utilize the Amazon Detective service to automatically detect negative user b,Transcribe audio recordings into text using Amazon Polly’s `StartSpeechSynthesisTask` operation. Set up Amazon Rekognition to recognize and automatically translate Hindi texts into English. Use the co,Utilize the Amazon Lex service to convert audio recordings into text. Call the Amazon Translate API to translate Hindi texts into English and use Amazon SageMaker Clarify for sentiment prediction and ,0,is: Convert audio recordings into text using Amazon Transcribe. Set up Amazon Translate to translate Hindi texts into English and use Amazon Comprehend for sentiment analysis.,"Amazon Transcribe is an AWS service that makes it easy for customers to convert speech-to-text. Using Automatic Speech Recognition (ASR) technology, customers can choose to use Amazon Transcribe for a variety of business applications, including transcription of voice-based customer service calls, generation of subtitles on audio/video content, and conduct (text-based) content analysis on audio/vid",Incorrect
284,dojo-exam3,secure-arch,"A travel company has a suite of web applications hosted in an Auto Scaling group of On-Demand EC2 instances behind an Application Load Balancer that handles traffic from various web domains such as `i-love-manila.com`,`i-love-boracay.com` `i-love-cebu.com` and many others. To improve security and lessen the overall cost, you are instructed to secure the system by allowing multiple domains to serve",Upload all SSL certificates of the domains in the ALB using the console and bind multiple certificates to the same secure listener on your load balancer. ALB will automatically choose the optimal TLS ,Use a wildcard certificate to handle multiple sub-domains and different domains.,Add a Subject Alternative Name (SAN) for each additional domain to your certificate.,Create a new CloudFront web distribution and configure it to serve HTTPS requests using dedicated IP addresses in order to associate your alternate domain names with a dedicated IP address in each Clo,0,is,"SNI Custom SSL relies on the SNI extension of the Transport Layer Security protocol, which allows multiple domains to serve SSL traffic over the same IP address by including the hostname which the viewers are trying to connect to.
You can host multiple TLS-secured applications, each with its own TLS certificate, behind a single load balancer. In order to use SNI, all you need to do is bind multipl",Incorrect
285,dojo-exam3,secure-arch,"A company uses multiple AWS accounts consolidated under AWS Organizations. The company needs to copy multiple Amazon S3 objects to an S3 bucket in a different owned AWS account. The Solutions Architect must configure permissions to enable this transfer while ensuring the destination account owns the copied objects rather than the source account.
How can the Architect accomplish this requirement?",Connect the two S3 buckets from two different AWS accounts to Amazon WorkDocs. Set up cross-account access to integrate the two S3 buckets. Use the WorkDocs console to copy the objects from one accoun,Configure cross-account permissions in S3 by creating an IAM customer-managed policy that allows an IAM user or role to copy objects from the source bucket in one account to the destination bucket in ,Set up cross-origin resource sharing (CORS) in S3 by creating a bucket policy that includes `AmazonS3FullAccess` and allows an IAM user or role to copy objects from the source bucket in one account to,Enable the Requester Pays feature in the source S3 bucket. The fees would be waived through Consolidated Billing since both AWS accounts are part of the organization.,1,is: Configure cross-account permissions in S3 by creating an IAM customer-managed policy that allows an IAM user or role to copy objects from the source bucket in one account to the destination bucket,"By default, an S3 object is owned by the account that uploaded the object. That’s why granting the destination account the permissions to perform the cross-account copy makes sure that the destination owns the copied objects. You can also change the ownership of an object by changing its access control list (ACL) to bucket-owner-full-control.
However, object ACLs can be difficult to manage for mul",Incorrect
286,dojo-exam3,high-perf-arch,"A media company recently launched their newly created web application. Many users tried to visit the website, but they are receiving a 503 Service Unavailable Error. The system administrator tracked the EC2 instance status and saw the capacity is reaching its maximum limit and unable to process all the requests. To gain insights from the application’s data, they need to launch a real-time analytic",Create a Kinesis Data Stream and use AWS Lambda to read records from the data stream.,Create an Amazon S3 bucket to store the captured data and use Amazon Redshift Spectrum to analyze the data.,Create a Data Firehose and use AWS Lambda to read records from the data stream.,Create an Amazon S3 bucket to store the captured data and use Amazon Athena to analyze the data.,0,in this scenario is: Create a Kinesis Data Stream and use AWS Lambda to read records from the data stream.,"Amazon Kinesis Data Streams (KDS) is a massively scalable and durable real-time data streaming service. KDS can continuously capture gigabytes of data per second from hundreds of thousands of sources. You can use an AWS Lambda function to process records in Amazon KDS. By default, Lambda invokes your function as soon as records are available in the stream. Lambda can process up to 10 batches in ea",Incorrect
287,dojo-exam3,secure-arch,"A company is generating confidential data that is saved on its on-premises data center. As a backup solution, the company wants to upload its data to an Amazon S3 bucket. In compliance with its internal security mandate, the encryption of the data must be done before sending it to S3. The company must spend time managing and rotating the encryption keys as well as controlling who can access those ",Set up Server-Side Encryption (SSE) with Amazon EC2 key pair.,Set up Client-Side Encryption with S3 managed encryption keys.,Set up Client-Side Encryption using a client-side master key.,Set up Server-Side Encryption with keys stored in a separate S3 bucket.,1,"Set up Client-Side Encryption with AWS KMS key.
– Set up Client-Side Encryption using a client-side master key.","Data protection refers to protecting data while in transit (as it travels to and from Amazon S3) and at rest (while it is stored on disks in Amazon S3 data centers). You can protect data in transit by using SSL or by using client-side encryption. You have the following options for protecting data at rest in Amazon S3:
Use Server-Side Encryption – You request Amazon S3 to encrypt your object before",Incorrect
288,dojo-exam3,secure-arch,"A company intends to give each of its developers a personal AWS account through AWS Organizations. To enforce regulatory policies, preconfigured AWS Config rules will be set in the new accounts. A solutions architect must see to it that developers are unable to remove or modify any rules in AWS Config.
Which solution meets the objective with the least operational overhead?",Add the developers' AWS account to an organization unit (OU). Attach a service control policy (SCP) to the OU that restricts access to AWS Config.,Set up an AWS Control Tower in the root account to detect if there were any changes to the new account’s AWS Config rules. Attach an IAM trust relationship to the IAM User of each developer which prev,Use an IAM Role in the new accounts with an attached IAM trust relationship to disable the access of the root user to AWS Config.,Configure an AWS Config rule in the root account to detect if changes to the new account’s Config rules are made.,0,,"Service control policies (SCPs) are a type of organization policy that you can use to manage permissions in your organization. SCPs offer central control over the maximum available permissions for all accounts in your organization. SCPs help you to ensure your accounts stay within your organization’s access control guidelines.

SCPs alone is not sufficient to grant permissions to the accounts in y",Incorrect
289,dojo-exam3,high-perf-arch,"A company is deploying a Microsoft SharePoint Server environment on AWS using CloudFormation. The Solutions Architect needs to install and configure the architecture that is composed of Microsoft Active Directory (AD) domain controllers, Microsoft SQL Server 2012, multiple Amazon EC2 instances to host the Microsoft SharePoint Server and many other dependencies. The Architect needs to ensure that t",Configure a `CreationPolicy` attribute to the instance in the CloudFormation template. Send a success signal after the applications are installed and configured using the `cfn-signal` helper script.,Configure the `UpdateReplacePolicy` attribute in the CloudFormation template. Send a success signal after the applications are installed and configured using the `cfn-signal` helper script.,Configure a `UpdatePolicy` attribute to the instance in the CloudFormation template. Send a success signal after the applications are installed and configured using the `cfn-signal` helper script.,Configure the `DependsOn` attribute in the CloudFormation template. Send a success signal after the applications are installed and configured using the `cfn-init` helper script.,0,,"You can associate the `CreationPolicy` attribute with a resource to prevent its status from reaching create complete until AWS CloudFormation receives a specified number of success signals or the timeout period is exceeded. To signal a resource, you can use the cfn-signal helper script or SignalResource API. AWS CloudFormation publishes valid signals to the stack events so that you track the numbe",Incorrect
290,dojo-exam3,secure-arch,"A company is hosting an application on EC2 instances that regularly pushes and fetches data in Amazon S3. Due to a change in compliance, the instances need to be moved on a private subnet. Along with this change, the company wants to lower the data transfer costs by configuring its AWS resources.
How can this be accomplished in the MOST cost-efficient manner?",Create an Amazon S3 gateway endpoint to enable a connection between the instances and Amazon S3.,Set up an AWS Transit Gateway to access Amazon S3.,Set up a NAT Gateway in the public subnet to connect to Amazon S3.,Create an Amazon S3 interface endpoint to enable a connection between the instances and Amazon S3.,0,is: Create an Amazon S3 gateway endpoint to enable a connection between the instances and Amazon S3.,"VPC endpoints for Amazon S3 simplify access to S3 from within a VPC by providing configurable and highly reliable secure connections to S3 that do not require an internet gateway or Network Address Translation (NAT) device. When you create an S3 VPC endpoint, you can attach an endpoint policy to it that controls access to Amazon S3.
You can use two types of VPC endpoints to access Amazon S3: gatew",Incorrect
291,dojo-exam3,resilient-arch,A Solutions Architect needs to deploy a mobile application that collects votes for a singing competition. Millions of users from around the world will submit votes using their mobile phones. These votes must be collected and stored in a highly scalable and highly available database which will be queried for real-time ranking. The database is expected to undergo frequent schema changes throughout t,Amazon DocumentDB (with MongoDB compatibility) and Amazon AppFlow,Amazon DynamoDB and AWS AppSync,Amazon Relational Database Service (RDS) and Amazon MQ,Amazon Aurora and Amazon Cognito,0,,"Amazon DynamoDB is a fully managed, serverless, key-value NoSQL database designed to run high-performance applications at any scale. DynamoDB offers built-in security, continuous backups, automated multi-Region replication, in-memory caching, and data import and export tools. DynamoDB tables are schemaless—other than the primary key, you do not need to define any extra attributes or data types whe",Incorrect
