ID,Source,Domain,Question,Option_A,Option_B,Option_C,Option_D,Correct_Index,Correct_Answer_Text,Explanation,Your_Result
425,dojo-exam5,resilient-arch,"A social media company needs to capture the detailed information of all HTTP requests that went through its public-facing Application Load Balancer every five minutes. The client’s IP address and network latencies must also be tracked, while the load balancer’s availability is monitored separately through the ELB health check. The captured data should be used for analyzing traffic patterns and for",Integrate Amazon EventBridge metrics on the Application Load Balancer to capture the client IP address. Use Amazon CloudWatch `GetMetricData` to retrieve and analyze traffic-related metrics.,Enable access logs on the Application Load Balancer. Integrate the ECS cluster with Amazon CloudWatch Application Insights to analyze traffic patterns and simplify troubleshooting.,Enable AWS CloudTrail for their Application Load Balancer. Use the CloudTrail Lake to analyze and troubleshoot the application traffic.,Install and run the AWS X-Ray daemon on the ECS cluster. Use the Amazon CloudWatch ServiceLens to analyze the traffic that goes through the application.,0,is: Enable access logs on the Application Load Balancer. Integrate the ECS cluster with Amazon CloudWatch Application Insights to analyze traffic patterns and simplify troubleshooting.,"Amazon CloudWatch Application Insights facilitates observability for your applications and underlying AWS resources. It helps you set up the best monitors for your application resources to continuously analyze data for signs of problems with your applications. Application Insights, which is powered by SageMaker and other AWS technologies, provides automated dashboards that show potential problems ",Incorrect
426,dojo-exam6,high-perf-arch,"A company is looking for a way to analyze the calls between customers and service agents. Each conversation is transcribed, JSON-formatted, and saved to an Amazon S3 bucket. The company’s solutions architect is tasked to design a solution for extracting and visualizing sentiments from the transcribed files.
Which solution meets the requirements while minimizing the amount of operational overhead?",Create an Amazon Comprehend analysis job. Index the sentiment along with the transcript to an Amazon OpenSearch cluster. Visualize the results using the OpenSearch Dashboard.,Analyze the JSON files with Amazon Textract. Index the sentiment along with the transcript to an Amazon OpenSearch cluster. Visualize the results using Amazon Managed Grafana.,Create an Amazon Comprehend analysis job. Index the sentiment along with the transcript to an Amazon OpenSearch cluster. Visualize the results using Amazon Managed Grafana.,Train a custom Natural Language Processing (NLP) model using Amazon SageMaker. Index the sentiment along with the transcript to an Amazon OpenSearch cluster. Visualize the results using the OpenSearch,0,is: Create an Amazon Comprehend analysis job. Index the sentiment along with the transcript to an Amazon OpenSearch cluster. Visualize the results using the OpenSearch Dashboard.,"Amazon Comprehend uses machine learning to help you uncover the insights and relationships in your unstructured data. The service identifies the language of the text; extracts key phrases, places, people, brands, or events; understands how positive or negative the text is; analyzes text using tokenization and parts of speech, and automatically organizes a collection of text files by topic. You can",Incorrect
427,dojo-exam6,cost-optimized-arch,"A company plans to use a cloud storage service to temporarily store its log files. The number of files to be stored is still unknown, but it only needs to be kept for 12 hours.
Which of the following is the most cost-effective storage class to use in this scenario?",Amazon S3 Standard,Amazon S3 One Zone-IA,Amazon S3 Standard-IA,Amazon S3 Glacier Deep Archive,2,"is: Amazon S3 Standard.
Amazon S3 Standard-IA is incorrect because this storage class has a minimum storage duration of at least 30 days. Remember that the scenario requires the data to be kept for 12","Amazon Simple Storage Service (Amazon S3) is an object storage service that offers industry-leading scalability, data availability, security, and performance. Amazon S3 also offers a range of storage classes for the objects that you store. You choose a class depending on your use case scenario and performance access requirements. All of these storage classes offer high durability.

The scenario re",Incorrect
428,dojo-exam6,resilient-arch,"A company deployed a fleet of Windows-based EC2 instances with IPv4 addresses launched in a private subnet. Several software installed in the EC2 instances are required to be updated via the Internet.
Which of the following services can provide the firm a highly available solution to safely allow the instances to fetch the software patches from the Internet but prevent outside network from initiat",Egress-Only Internet Gateway,NAT Instance,VPC Endpoint,NAT Gateway,0,,"AWS offers two kinds of NAT devices — a NAT gateway or a NAT instance. It is recommended to use NAT gateways, as they provide better availability and bandwidth over NAT instances. The NAT Gateway service is also a managed service that does not require your administration efforts. A NAT instance is launched from a NAT AMI.
Just like a NAT instance, you can use a network address translation (NAT) ga",Incorrect
429,dojo-exam6,high-perf-arch,"A Solutions Architect designed a real-time data analytics system based on Kinesis Data Stream and Lambda. A week after the system has been deployed, the users noticed that it performed slowly as the data rate increases. The Architect identified that the performance of the Kinesis Data Streams is causing this problem.
Which of the following should the Architect do to improve performance?",Improve the performance of the stream by decreasing the number of its shards using the `MergeShard` command.,Increase the number of shards of the Kinesis stream by using the `UpdateShardCount` command.,Replace the data stream with Amazon Data Firehose instead.,Implement Step Scaling to the Kinesis Data Stream.,0,is: Increase the number of shards of the Kinesis stream by using the `UpdateShardCount` command.,"Amazon Kinesis Data Streams supports resharding, which lets you adjust the number of shards in your stream to adapt to changes in the rate of data flow through the stream. Resharding is considered an advanced operation.
There are two types of resharding operations: shard split and shard merge. In a shard split, you divide a single shard into two shards. In a shard merge, you combine two shards int",Incorrect
430,dojo-exam6,secure-arch,"A Solutions Architect created a brand new IAM User with a default setting using AWS CLI. This is intended to be used to send API requests to Amazon S3, DynamoDB, Lambda, and other AWS resources of the company’s cloud infrastructure.
Which of the following must be done to allow the user to make API calls to the AWS resources?",Enable Multi-Factor Authentication for the user.,Create a set of Access Keys for the user and attach the necessary permissions.,Do nothing as the IAM User is already capable of sending API calls to your AWS resources.,Assign an IAM Policy to the user to allow it to send API calls.,0,,"You can choose the credentials that are right for your IAM user. When you use the AWS Management Console to create a user, you must choose to include at least a console password or access keys. By default, a brand new IAM user created using the AWS CLI or AWS API has no credentials of any kind. You must create the type of credentials for an IAM user based on the needs of your user.
Access keys are",Incorrect
431,dojo-exam6,resilient-arch,"A multinational company has been building its new data analytics platform with high-performance computing workloads (HPC) which requires a scalable, POSIX-compliant storage service. The data need to be stored redundantly across multiple AZs and allows concurrent connections from thousands of EC2 instances hosted on multiple Availability Zones.
Which of the following AWS storage service is the most",Amazon EBS Volumes,Amazon Elastic File System,Amazon S3,Amazon ElastiCache,0,,"In this question, you should take note of this phrase: “allows concurrent connections from multiple EC2 instances”. There are various AWS storage options that you can choose but whenever these criteria show up, always consider using EFS instead of using EBS Volumes which is mainly used as a “block” storage and can only have one connection to one EC2 instance at a time.
Amazon EFS is a fully-manage",Incorrect
432,dojo-exam6,cost-optimized-arch,"A game development company operates several virtual reality (VR) and augmented reality (AR) games that use various RESTful web APIs hosted in its on-premises data center, which currently sits behind a content delivery network (CDN) for faster global delivery. Due to the unprecedented growth of the company, the management decided to migrate its system to AWS Cloud to scale out its resources as well",Use AWS Lambda and Amazon API Gateway.,"Set up a micro-service architecture with Amazon ECS, Amazon ECR, and AWS Fargate.",Host the APIs in a static Amazon S3 web hosting bucket behind a Amazon CloudFront web distribution.,"Use a Spot Fleet of Amazon EC2 instances, each with an Elastic Fabric Adapter (EFA) for more consistent latency and higher network throughput. Set up an Application Load Balancer to distribute traffic",0,is: Use AWS Lambda and Amazon API Gateway.,"With AWS Lambda, you pay only for what you use. You are charged based on the number of requests for your functions and the duration, the time it takes for your code to execute.
Lambda counts a request each time it starts executing in response to an event notification or invoke call, including test invokes from the console. You are charged for the total number of requests across all your functions.",Incorrect
433,dojo-exam6,high-perf-arch,"A company plans to implement a network monitoring system in AWS. The Solutions Architect launched an EC2 instance to host the monitoring system and used CloudWatch to monitor, store, and access the log files of the instance.
Which of the following provides an automated way to send log data to CloudWatch Logs from the Amazon EC2 instance?",CloudWatch Logs agent,AWS Transfer for SFTP,CloudTrail with log file validation,CloudTrail Processing Library,0,,"CloudWatch Logs enables you to centralize the logs from all of your systems, applications, and AWS services that you use, in a single, highly scalable service. You can then easily view them, search them for specific error codes or patterns, filter them based on specific fields, or archive them securely for future analysis. CloudWatch Logs enables you to see all of your logs, regardless of their so",Incorrect
434,dojo-exam6,high-perf-arch,"A company is planning to deploy a High Performance Computing (HPC) cluster in its VPC that requires a scalable, high-performance file system. The storage service must be optimized for efficient workload processing, and the data must be accessible via a fast and scalable file system interface. It should also work natively with Amazon S3 that enables you to easily process your S3 data with a high-pe",Amazon FSx for Lustre,Amazon Elastic Block Storage (EBS),Amazon FSx for Windows File Server,Amazon Elastic File System (EFS),1,"is: Amazon FSx for Lustre.
Amazon Elastic File System (EFS) is incorrect. Although the EFS service can be used for HPC applications, it doesn’t natively work with Amazon S3. It doesn’t have the capabi","Amazon FSx for Lustre provides a high-performance file system optimized for fast processing of workloads such as machine learning, high performance computing (HPC), video processing, financial modeling, and electronic design automation (EDA). These workloads commonly require data to be presented via a fast and scalable file system interface and typically have data sets stored on long-term data sto",Incorrect
435,dojo-exam6,resilient-arch,A company plans to host a movie streaming app in AWS. The chief information officer (CIO) wants to ensure that the application is highly available and scalable. The application is deployed to an AWS Auto Scaling group of Amazon EC2 instances on multiple AZs with NAT gateways configured for outbound internet traffic. A load balancer must be configured to distribute incoming requests evenly to all E,Amazon VPC IP Address Manager (IPAM),Cross-zone load balancing,Path-based Routing,AWS Direct Connect SiteLink,0,"is: Cross-zone load balancing.
Amazon VPC IP Address Manager (IPAM) is incorrect because this is merely a feature in Amazon VPC that provides network administrators with an automated IP management wor","The nodes for your load balancer distribute requests from clients to registered targets. When cross-zone load balancing is enabled, each load balancer node distributes traffic across the registered targets in all enabled Availability Zones. When cross-zone load balancing is disabled, each load balancer node distributes traffic only across the registered targets in its Availability Zone.
The follow",Incorrect
436,dojo-exam6,resilient-arch,"A Solutions Architect needs to launch a web application that will be served globally using Amazon CloudFront. The application is hosted in an Amazon EC2 instance which will be configured as the origin server to process and serve dynamic content to its customers.
Which of the following options provides high availability for the application?",Use Amazon S3 to serve the dynamic content of your web application and configure the S3 bucket to be part of an origin group.,Provision two EC2 instances deployed in different Availability Zones and configure them to be part of an origin group.,Launch an Auto Scaling group of EC2 instances and configure it to be part of an origin group.,Use Lambda@Edge to improve the performance of your web application and ensure high availability. Set the Lambda@Edge functions to be part of an origin group.,0,is: Provision two EC2 instances deployed in different Availability Zones and configure them to be part of an origin group.,"An origin is a location where content is stored and from which CloudFront gets content to serve to viewers. Amazon CloudFront is a service that speeds up the distribution of your static and dynamic web content, such as .html, .css, .js, and image files, to your users. CloudFront delivers your content through a worldwide network of data centers called edge locations. When a user requests content th",Incorrect
437,dojo-exam6,high-perf-arch,"A company has a VPC for its Human Resource department and another VPC located in different AWS regions for its Finance department. The Solutions Architect must redesign the architecture to allow the finance department to access all resources that are in the human resource department, and vice versa. An Intrusion Prevention System (IPS) must also be integrated for active traffic flow inspection and",Establish a secure connection between the two VPCs using a NAT Gateway. Manage user sessions via the AWS Systems Manager Session Manager service.,Launch an AWS Transit Gateway and add VPC attachments to connect all departments. Set up AWS Network Firewall to secure the application traffic travelling between the VPCs.,Create a Direct Connect Gateway and add VPC attachments to connect all departments. Configure AWS Security Hub to secure the application traffic travelling between the VPCs.,Create a Traffic Policy in Amazon Route 53 to connect the two VPCs. Configure the Route 53 Resolver DNS Firewall to do active traffic flow inspection and block any vulnerability exploits.,1,is: Launch a Transit Gateway and add VPC attachments to connect all departments. Set up AWS Network Firewall to secure the application traffic travelling between the VPCs.,"A transit gateway is a network transit hub that you can use to interconnect your virtual private clouds (VPCs) and on-premises networks. As your cloud infrastructure expands globally, inter-Region peering connects transit gateways together using the AWS Global Infrastructure. Your data is automatically encrypted and never travels over the public internet.

A transit gateway attachment is both a so",Incorrect
438,dojo-exam6,resilient-arch,"An application is hosted in an Auto Scaling group of EC2 instances and a Microsoft SQL Server on Amazon RDS. There is a requirement that all in-flight data between your web servers and RDS should be secured.
Which of the following options is the MOST suitable solution that you should implement? (Select TWO.)",Enable the IAM DB authentication in RDS using the AWS Management Console.,"Force all connections to your DB instance to use SSL by setting the `rds.force_ssl` parameter to true. Once done, reboot your DB instance.",Download the Amazon RDS Root CA certificate. Import the certificate to your servers and configure your application to use SSL to encrypt the connection to RDS.,Configure the security groups of your EC2 instances and RDS to only allow traffic to and from port 443.,0,,"You can use Secure Sockets Layer (SSL) to encrypt connections between your client applications and your Amazon RDS DB instances running Microsoft SQL Server. SSL support is available in all AWS regions for all supported SQL Server editions.
When you create an SQL Server DB instance, Amazon RDS creates an SSL certificate for it. The SSL certificate includes the DB instance endpoint as the Common Na",Incorrect
439,dojo-exam6,high-perf-arch,"An application is using an AWS Lambda function to process complex financial data that runs for 15 minutes on average. The Lambda function has been configured with the maximum memory allocation to handle the computational demands of the financial data processing. Most invocations were successfully processed. However, a few terminated invocations were noticed throughout the day, which caused a data ",The failed Lambda Invocations contain a `ServiceException` error which means that the Lambda service encountered an internal error.,The Lambda function contains a recursive code and has been running for over 15 minutes.,The concurrent execution limit has been reached.,The failed Lambda functions have been running for over 15 minutes and reached the maximum execution time.,1,is: The failed Lambda functions have been running for over 15 minutes and reached the maximum execution time.,"An AWS Lambda function consists of code and any associated dependencies. In addition, a Lambda function also has configuration information associated with it. Initially, you specify the configuration information when you create a Lambda function. Lambda provides an API for you to update some of the configuration data.
You pay for the AWS resources that are used to run your Lambda function. To prev",Incorrect
440,dojo-exam6,high-perf-arch,"A company has an application that uses multiple EC2 instances located in various AWS regions such as US East (Ohio), US West (N. California), and EU (Ireland). The manager instructed the Solutions Architect to set up a latency-based routing to route incoming traffic for www.tutorialsdojo.com to all the EC2 instances across all AWS regions.
Which of the following options can satisfy the given requi",Use AWS DataSync to distribute the load to the multiple EC2 instances across all AWS Regions.,Use a Network Load Balancer to distribute the load to the multiple EC2 instances across all AWS Regions.,Use Route 53 to distribute the load to the multiple EC2 instances across all AWS Regions.,Use an Application Load Balancer to distribute the load to the multiple EC2 instances across all AWS Regions.,0,,"If your application is hosted in multiple AWS Regions, you can improve performance for your users by serving their requests from the AWS Region that provides the lowest latency.
You can create latency records for your resources in multiple AWS Regions by using latency-based routing. In the event that Route 53 receives a DNS query for your domain or subdomain such as tutorialsdojo.com or portal.tut",Incorrect
441,dojo-exam6,high-perf-arch,"An application is loading hundreds of JSON documents into an Amazon S3 bucket every hour which is registered in AWS Lake Formation as a data catalog. The Data Analytics team uses Amazon Athena to run analyses on these data, but due to the volume, most queries take a long time to complete.
What change should be made to improve the query performance while ensuring data security?",Compress the data into GZIP format before storing it in the S3 bucket. Apply an IAM policy with `aws:SourceArn` and `aws:SourceAccount` global condition context keys in Lake Formation that prevents cr,Apply minification on the data and implement the Lake Formation tag-based access control (LF-TBAC) authorization strategy to ensure security.,Transform the JSON data into Apache Parquet format. Ensure that the user has an `lakeformation:GetDataAccess` IAM permission for underlying data access control.,Convert the JSON documents into CSV format. Provide fine-grained named resource access control to specific databases or tables in AWS Lake Formation.,0,,"Amazon Athena supports a wide variety of data formats like CSV, TSV, JSON, or Textfiles and also supports open-source columnar formats such as Apache ORC and Apache Parquet. Athena also supports compressed data in Snappy, Zlib, LZO, and GZIP formats. By compressing, partitioning, and using columnar formats you can improve performance and reduce your costs.
Parquet and ORC file formats both support",Incorrect
442,dojo-exam6,high-perf-arch,"A manufacturing company launched a new type of IoT sensor that collects large streams of data records. A Solutions Architect needs to design a solution that can ingest and analyze the data in real time with millisecond response times.
Which of the following is the best option that should be implemented in this scenario?","Ingest the data by directly writing to Amazon DynamoDB using Provisioned Capacity mode with 1,000 Read Capacity Units (RCU) and 1,000 Write Capacity Units (WCU).",Ingest the data using Amazon Simple Queue Service and create an AWS Lambda function to store the data in Amazon Redshift.,Ingest the data using Amazon Kinesis Data Streams and create an AWS Lambda function to store the data in Amazon DynamoDB.,Ingest the data using Amazon Kinesis Data Streams and create an AWS Lambda function to store the data in Amazon Redshift.,0,is: Ingest the data using Amazon Kinesis Data Streams and create an AWS Lambda function to store the data in Amazon DynamoDB.,"Amazon Kinesis Data Streams is a fully managed service that enables applications to collect, process, and analyze large streams of data in real time. It can continuously ingest streaming data such as application logs, IoT telemetry, clickstreams, and event data from thousands of producers. The service allows multiple consumers to process the data as it arrives, enabling near real-time analytics an",Incorrect
443,dojo-exam6,high-perf-arch,"A game company has a requirement of load balancing the incoming TCP traffic at the transport level (Layer 4) to their containerized gaming servers hosted in AWS Fargate. To maintain performance, it should handle millions of requests per second sent by gamers around the globe while maintaining ultra-low latencies.
Which of the following must be implemented in the current architecture to satisfy the",Launch a new microservice in AWS Fargate that acts as a load balancer since using an ALB or NLB with Fargate is not possible.,Launch a new Application Load Balancer.,Create a new record in Amazon Route 53 with Weighted Routing policy to load balance the incoming traffic.,Launch a new Network Load Balancer.,3,is to launch a new Network Load Balancer.,"Elastic Load Balancing automatically distributes incoming application traffic across multiple targets, such as Amazon EC2 instances, containers, IP addresses, and Lambda functions. It can handle the varying load of your application traffic in a single Availability Zone or across multiple Availability Zones. Elastic Load Balancing offers three types of load balancers that all feature the high avail",Incorrect
444,dojo-exam6,resilient-arch,"A Solutions Architect is trying to enable Cross-Region Replication to an Amazon S3 bucket but this option is disabled. The bucket has been configured with a Multi-Region Access Point to manage incoming requests.
Which of the following options is a valid reason for this?",The Cross-Region Replication feature is only available for S3 – One Zone-IA.,The Cross-Region Replication feature is only available for S3 – Infrequent Access.,This is a premium feature which is only for AWS Enterprise accounts.,"In order to use the Cross-Region Replication feature in S3, you need to first enable versioning on the bucket.",0,"is: In order to use the Cross-Region Replication feature in S3, you need to first enable versioning on the bucket.","To enable the cross-region replication feature in S3, the following items should be met:
   1. The source and destination buckets must have versioning enabled.
   2. The source and destination buckets must be in different AWS Regions.
   3. Amazon S3 must have permission to replicate objects from that source bucket to the destination bucket on your behalf.

Hence, the correct answer is: In order t",Incorrect
